company_name,job_type,job_name,description,qualifications
Klarity,Unknown,Jr. AI Front-end Engineer,Job opening at Klarity for Jr. AI Front-end Engineer.,Front-End Engineer
Resonance,Unknown,Front End Engineer,Job opening at Resonance for Front End Engineer.,Front-End Engineer
Hadrian,Unknown,Frontend Software Engineer,Job opening at Hadrian for Frontend Software Engineer.,Front-End Engineer
Backpack,Unknown,Frontend Engineer,Job opening at Backpack for Frontend Engineer.,Front-End Engineer
The Agora Companies,Unknown,Junior Front End Developer,"Baltimore, MD",Front-End Engineer
Tinder,Unknown,LinkedIn,Job opening at Tinder for LinkedIn.,Back-End Engineer
Tinder,Unknown,Backend Engineer Intern,Job opening at Tinder for Backend Engineer Intern.,Back-End Engineer
Apple,Unknown,Software Engineer - Early Career (Backend/Data),Job opening at Apple for Software Engineer - Early Career (Backend/Data).,Back-End Engineer
Notion,Unknown,"Software Engineer, Fullstack, Early Career","Job opening at Notion for Software Engineer, Fullstack, Early Career.",Back-End Engineer
Baselayer,Unknown,Junior Backend Engineer,Job opening at Baselayer for Junior Backend Engineer.,Back-End Engineer
Notion,Unknown,"Software Engineer, Fullstack, Early Career","Job opening at Notion for Software Engineer, Fullstack, Early Career.",Full-Stack Engineer
OffDeal,Unknown,Full Stack Engineer (New Grad),Job opening at OffDeal for Full Stack Engineer (New Grad).,Full-Stack Engineer
Apple,Unknown,Full Stack Software Engineer,Job opening at Apple for Full Stack Software Engineer.,Full-Stack Engineer
Apple,Unknown,Software Engineer - Early Career (Backend/Data),Job opening at Apple for Software Engineer - Early Career (Backend/Data).,Full-Stack Engineer
Apple,Unknown,Full-Stack Software Engineer,Job opening at Apple for Full-Stack Software Engineer.,Full-Stack Engineer
Notion,Unknown,"Software Engineer, Mobile Platform (Android)","Job opening at Notion for Software Engineer, Mobile Platform (Android).",Mobile Engineer
"Palo Alto, CA",Unknown,Mobile Android Engineer,11 hours ago,Mobile Engineer
"Palo Alto, CA",Unknown,xAI,11 hours ago,Mobile Engineer
"Helena, MT",Unknown,Mobile App Developer,"Job opening at Helena, MT for Mobile App Developer.",Mobile Engineer
"Helena, MT",Unknown,Veracity Software Inc,"Job opening at Helena, MT for Veracity Software Inc.",Mobile Engineer
Meter,Unknown,"Software Engineer, Models","Job opening at Meter for Software Engineer, Models.",Systems Engineer
Netflix,Unknown,Distributed Systems Engineer (L4) - Cloud Engineering,Job opening at Netflix for Distributed Systems Engineer (L4) - Cloud Engineering.,Systems Engineer
Apple,Unknown,Software Engineer - Early Career (Backend/Data),Job opening at Apple for Software Engineer - Early Career (Backend/Data).,Systems Engineer
Honeywell,Unknown,Systems Engineering - Recent Grad/Full Time,Job opening at Honeywell for Systems Engineering - Recent Grad/Full Time.,Systems Engineer
Netflix,Unknown,Distributed Systems Engineer (L4) - Data Platform,Job opening at Netflix for Distributed Systems Engineer (L4) - Data Platform.,Systems Engineer
Unknown Company,Unknown,"Software Engineer, Games - Web Platform",,Game Developer
Twine,Unknown,"Software Engineer, Games - Web Platform","Job opening at Twine for Software Engineer, Games - Web Platform.",Game Developer
Great Value Hiring,Unknown,Game Developer,Job opening at Great Value Hiring for Game Developer.,Game Developer
Unknown Company,Unknown,Game Developer,,Game Developer
Unknown Company,Unknown,Verita AI,,Game Developer
Integrated Finance & Accounting Solutions (IFAS),Unknown,Information System Security Officer,Job opening at Integrated Finance & Accounting Solutions (IFAS) for Information System Security Officer.,Security Analyst
lululemon,Unknown,"Charleston, SC","Job opening at lululemon for Charleston, SC.",Security Analyst
lululemon,Unknown,Security Analyst - SOC,Job opening at lululemon for Security Analyst - SOC.,Security Analyst
"ProSync Technology Group, LLC",Unknown,Jr. Information Security Analyst,"Washington, DC",Security Analyst
KellyMitchell Group,Unknown,Security Analyst,"Englewood, CO",Security Analyst
Yoda Tech,Unknown,Junior Cybersecurity Engineer,Job opening at Yoda Tech for Junior Cybersecurity Engineer.,Penetration Tester
19 minutes ago,Unknown,Associate Security Consultant | Junior Penetration Tester,Job opening at 19 minutes ago for Associate Security Consultant | Junior Penetration Tester.,Penetration Tester
19 minutes ago,Unknown,UltraViolet Cyber,Job opening at 19 minutes ago for UltraViolet Cyber.,Penetration Tester
19 minutes ago,Unknown,United States,Job opening at 19 minutes ago for United States.,Penetration Tester
Netflix,Unknown,Security Engineer (L4) - Application Security,Job opening at Netflix for Security Engineer (L4) - Application Security.,Penetration Tester
Astera Institute,Unknown,"Software Engineer, The Stacks - Radial Science","Job opening at Astera Institute for Software Engineer, The Stacks - Radial Science.",Security Engineer
Unknown Company,Unknown,Jr. Security Engineer (Full Time) - Sugar Land,,Security Engineer
Unknown Company,Unknown,Prosperity Bank,,Security Engineer
Meter,Unknown,"Sugar Land, TX","Job opening at Meter for Sugar Land, TX.",Security Engineer
Meter,Unknown,"Software Engineer, Models","Job opening at Meter for Software Engineer, Models.",Security Engineer
MedReview Inc.,Unknown,Azure Cloud Security Engineer,Job opening at MedReview Inc. for Azure Cloud Security Engineer.,Cloud Security Engineer
"Sugar Land, TX",Unknown,Jr. Security Engineer (Full Time) - Sugar Land,"Job opening at Sugar Land, TX for Jr. Security Engineer (Full Time) - Sugar Land.",Cloud Security Engineer
"Sugar Land, TX",Unknown,Prosperity Bank,"Job opening at Sugar Land, TX for Prosperity Bank.",Cloud Security Engineer
HealthMark Group,Unknown,Security Engineer,Job opening at HealthMark Group for Security Engineer.,Cloud Security Engineer
Koda Health,Unknown,Senior Infrastructure & Security Engineer,Job opening at Koda Health for Senior Infrastructure & Security Engineer.,Cloud Security Engineer
"Kraft & Kennedy, Inc.",Unknown,SOC Analyst,"Job opening at Kraft & Kennedy, Inc. for SOC Analyst.",SOC Analyst
lululemon,Unknown,Security Analyst - SOC,Job opening at lululemon for Security Analyst - SOC.,SOC Analyst
Astreya,Unknown,Security Operations Center Analyst,Job opening at Astreya for Security Operations Center Analyst.,SOC Analyst
Kforce Inc,Unknown,"Austin, TX","Alexandria, VA",SOC Analyst
Kforce Inc,Unknown,SOC Analyst,"Alexandria, VA",SOC Analyst
LinkedIn,Unknown,Engineering Director - Information Security,Job opening at LinkedIn for Engineering Director - Information Security.,Application Security
Netflix,Unknown,Security Engineer (L4) - Application Security,Job opening at Netflix for Security Engineer (L4) - Application Security.,Application Security
Integrated Finance & Accounting Solutions (IFAS),Unknown,Information System Security Officer,Job opening at Integrated Finance & Accounting Solutions (IFAS) for Information System Security Officer.,Application Security
Unknown Company,Unknown,"Charleston, SC",,Application Security
Unknown Company,Unknown,"Engineering Director, Application Security",,Application Security
Vaco by Highspring,Unknown,GRC Analyst,Job opening at Vaco by Highspring for GRC Analyst.,GRC Analyst
Inceed,Unknown,"Dallas, TX","Job opening at Inceed for Dallas, TX.",GRC Analyst
Inceed,Unknown,GRC Analyst,Job opening at Inceed for GRC Analyst.,GRC Analyst
RouteOne,Unknown,GRC Analyst,"Farmington Hills, MI Medical insurance +5 benefits",GRC Analyst
Unknown Company,Unknown,GRC Analyst,,GRC Analyst
Tinder,Unknown,Machine Learning Engineer Intern,Job opening at Tinder for Machine Learning Engineer Intern.,Machine Learning Engineer
Fanatics,Unknown,Data Scientist,"Denver, CO",Machine Learning Engineer
Meter,Unknown,"Software Engineer, Models","Job opening at Meter for Software Engineer, Models.",Machine Learning Engineer
Medical insurance +5 benefits,Unknown,Data Scientist,Job opening at Medical insurance +5 benefits for Data Scientist.,Machine Learning Engineer
Medical insurance +5 benefits,Unknown,Zest AI,Job opening at Medical insurance +5 benefits for Zest AI.,Machine Learning Engineer
Tinder,Unknown,Data Scientist Intern,Job opening at Tinder for Data Scientist Intern.,Data Scientist
Netflix,Unknown,Data Scientist (L4) - Marketing and Experience DSE,Job opening at Netflix for Data Scientist (L4) - Marketing and Experience DSE.,Data Scientist
"Denver, CO",Unknown,Data Scientist,"Job opening at Denver, CO for Data Scientist.",Data Scientist
"Denver, CO",Unknown,Fanatics,"Job opening at Denver, CO for Fanatics.",Data Scientist
Roku,Unknown,Data Scientist,Job opening at Roku for Data Scientist.,Data Scientist
Netflix,Unknown,LinkedIn,Job opening at Netflix for LinkedIn.,AI Engineer
Netflix,Unknown,Machine Learning Engineer (L4/L5) - Emerging Game Technologies,Job opening at Netflix for Machine Learning Engineer (L4/L5) - Emerging Game Technologies.,AI Engineer
Unknown Company,Unknown,"Los Angeles, CA",,AI Engineer
"Palo Alto, CA",Unknown,AI/ML Engineer (Recent Grad),"Job opening at Palo Alto, CA for AI/ML Engineer (Recent Grad).",AI Engineer
"Palo Alto, CA",Unknown,Nightfall AI,"Job opening at Palo Alto, CA for Nightfall AI.",AI Engineer
Synergy ECP,Unknown,LinkedIn,"Columbia, MD",NLP Engineer
Synergy ECP,Unknown,Junior AI Engineer,"Columbia, MD",NLP Engineer
Qualcomm,Unknown,"Engineer, Machine Learning Engineering (ML Apps)","Job opening at Qualcomm for Engineer, Machine Learning Engineering (ML Apps).",NLP Engineer
Unknown Company,Unknown,"Engineer, AI / ML & Analytics Platform Engineering",,NLP Engineer
Unknown Company,Unknown,Veracity Software Inc,,NLP Engineer
Giga,Unknown,Software Engineer (New Grads) - New York,Job opening at Giga for Software Engineer (New Grads) - New York.,Computer Vision Engineer
Tinder,Unknown,Machine Learning Engineer Intern,Job opening at Tinder for Machine Learning Engineer Intern.,Computer Vision Engineer
Apple,Unknown,Machine Learning/Computer Vision Engineer,Job opening at Apple for Machine Learning/Computer Vision Engineer.,Computer Vision Engineer
Meter,Unknown,"Software Engineer, Models","Job opening at Meter for Software Engineer, Models.",Computer Vision Engineer
Netflix,Unknown,Machine Learning Engineer (L4/L5) - Emerging Game Technologies,Job opening at Netflix for Machine Learning Engineer (L4/L5) - Emerging Game Technologies.,Computer Vision Engineer
Zing Recruiting,Unknown,QC Chemist,"Newark, DE",Research Scientist
"Boca Raton, FL",Unknown,Research And Development Chemist,Medical insurance +4 benefits,Research Scientist
"Boca Raton, FL",Unknown,Barentz,Medical insurance +4 benefits,Research Scientist
Oakwood Labs,Unknown,Chemist,Greater Cleveland Medical insurance +4 benefits,Research Scientist
PDI,Unknown,R&D Scientist II,"Woodcliff Lake, NJ Medical insurance +7 benefits",Research Scientist
Protingent,Unknown,BI Developer,"Kirkland, WA 7 hours ago",BI Developer
Kobie,Unknown,BI Report Developer,"Philadelphia, PA",BI Developer
Unknown Company,Unknown,Business Intelligence Analyst/Developer,,BI Developer
Unknown Company,Unknown,MedReview Inc.,,BI Developer
CGS Federal (Contact Government Services),Unknown,Power BI Developer,Job opening at CGS Federal (Contact Government Services) for Power BI Developer.,BI Developer
Unknown Company,Unknown,Data Visualization Engineer,,Data Visualization Engineer
Unknown Company,Unknown,Data Visualization Society,,Data Visualization Engineer
Kforce Inc,Unknown,Data Visualization Platform Engineer,"Piscataway, NJ",Data Visualization Engineer
myGwork - LGBTQ+ Business Community,Unknown,Data Visualization Engineer,Job opening at myGwork - LGBTQ+ Business Community for Data Visualization Engineer.,Data Visualization Engineer
Apt,Unknown,Data Visualization Engineer,"Birmingham, AL 401(k) +3 benefits",Data Visualization Engineer
LinkedIn,Unknown,Data Visualization Developer,Job opening at LinkedIn for Data Visualization Developer.,Analytics Engineer
Netflix,Unknown,Analytics Engineer 4 - Ads,Job opening at Netflix for Analytics Engineer 4 - Ads.,Analytics Engineer
Netflix,Unknown,United States,Job opening at Netflix for United States.,Analytics Engineer
Netflix,Unknown,Data Engineer (L5),Job opening at Netflix for Data Engineer (L5).,Analytics Engineer
Netflix,Unknown,Data Engineer (L5) - Messaging,Job opening at Netflix for Data Engineer (L5) - Messaging.,Analytics Engineer
MedReview Inc.,Unknown,Business Analyst - Operations,Job opening at MedReview Inc. for Business Analyst - Operations.,Reporting Analyst
WorldStrides,Unknown,Business Analyst,Job opening at WorldStrides for Business Analyst.,Reporting Analyst
Atlantic Group,Unknown,Data Reporting Analyst,Job opening at Atlantic Group for Data Reporting Analyst.,Reporting Analyst
Simpson Thacher & Bartlett LLP,Unknown,Data Reporting Analyst,Job opening at Simpson Thacher & Bartlett LLP for Data Reporting Analyst.,Reporting Analyst
"Columbia, SC",Unknown,Financial Reporting Analyst,"Job opening at Columbia, SC for Financial Reporting Analyst.",Reporting Analyst
Tinder,Unknown,Cloud Infrastructure Engineer Intern,Job opening at Tinder for Cloud Infrastructure Engineer Intern.,Cloud Infrastructure Engineer
Tamarind Bio,Unknown,Infrastructure Engineer,Job opening at Tamarind Bio for Infrastructure Engineer.,Cloud Infrastructure Engineer
MedReview Inc.,Unknown,Azure Cloud Security Engineer,Job opening at MedReview Inc. for Azure Cloud Security Engineer.,Cloud Infrastructure Engineer
Hadrian,Unknown,Infrastructure Engineer,Job opening at Hadrian for Infrastructure Engineer.,Cloud Infrastructure Engineer
Prelude,Unknown,Infrastructure Engineer,Job opening at Prelude for Infrastructure Engineer.,Cloud Infrastructure Engineer
Apple,Unknown,Multi-Cloud Solutions Architect,Job opening at Apple for Multi-Cloud Solutions Architect.,Cloud Architect
Meta,Unknown,Solutions Architect,Job opening at Meta for Solutions Architect.,Cloud Architect
Kforce Inc,Unknown,"Cloud Solutions Architect, SME","Huntsville, AL",Cloud Architect
Largeton Group,Unknown,Senior Cloud Solutions Architect,Job opening at Largeton Group for Senior Cloud Solutions Architect.,Cloud Architect
2 hours ago,Unknown,United States,Job opening at 2 hours ago for United States.,Cloud Architect
Gen,Unknown,Sr Site Reliability Engineer - ML,Job opening at Gen for Sr Site Reliability Engineer - ML.,Site Reliability Engineer
Esri,Unknown,DevOps Systems Engineer,Job opening at Esri for DevOps Systems Engineer.,Site Reliability Engineer
Meter,Unknown,"Software Engineer, Models","Job opening at Meter for Software Engineer, Models.",Site Reliability Engineer
Ivanti,Unknown,Site Reliability Engineer,Job opening at Ivanti for Site Reliability Engineer.,Site Reliability Engineer
PTC,Unknown,DevOps Engineer,"Shoreview, MN",Site Reliability Engineer
Nuro,Unknown,"Software Engineer, AI Platform - New Grad","Job opening at Nuro for Software Engineer, AI Platform - New Grad.",Platform Engineer
Tinder,Unknown,"Mountain View, CA","Job opening at Tinder for Mountain View, CA.",Platform Engineer
Tinder,Unknown,Cloud Infrastructure Engineer Intern,Job opening at Tinder for Cloud Infrastructure Engineer Intern.,Platform Engineer
Netflix,Unknown,"Los Angeles, CA","Job opening at Netflix for Los Angeles, CA.",Platform Engineer
Netflix,Unknown,Distributed Systems Engineer (L4) - Cloud Engineering,Job opening at Netflix for Distributed Systems Engineer (L4) - Cloud Engineering.,Platform Engineer
SKIMS,Unknown,Project Manager,Job opening at SKIMS for Project Manager.,Agile Project Manager
ted,Unknown,"Los Angeles, CA","Cincinnati, OH",Agile Project Manager
ted,Unknown,Project Manager,"Cincinnati, OH",Agile Project Manager
Amazon,Unknown,"Project Manager, GEMS, NA Startup","Job opening at Amazon for Project Manager, GEMS, NA Startup.",Agile Project Manager
Laland Baptiste,Unknown,Project Manager,Job opening at Laland Baptiste for Project Manager.,Agile Project Manager
Zillow,Unknown,"Program Manager, Early Talent","Job opening at Zillow for Program Manager, Early Talent.",Program Manager
Netflix,Unknown,"Retail Program Manager, Experiences","Job opening at Netflix for Retail Program Manager, Experiences.",Program Manager
LinkedIn,Unknown,"Los Angeles, CA","Job opening at LinkedIn for Los Angeles, CA.",Program Manager
LinkedIn,Unknown,Insights Program Manager,Job opening at LinkedIn for Insights Program Manager.,Program Manager
Netflix,Unknown,Human Evaluation - Program Manager,Job opening at Netflix for Human Evaluation - Program Manager.,Program Manager
Google,Unknown,"Product Manager I, Ads","Job opening at Google for Product Manager I, Ads.",Technical Product Manager
Apple,Unknown,"Product/Senior Product Manager, AppleCare","Job opening at Apple for Product/Senior Product Manager, AppleCare.",Technical Product Manager
FanDuel,Unknown,"Product Manager, New Ventures","Job opening at FanDuel for Product Manager, New Ventures.",Technical Product Manager
LinkedIn,Unknown,"Senior Product Manager, New Member Acquisition","Job opening at LinkedIn for Senior Product Manager, New Member Acquisition.",Technical Product Manager
Google,Unknown,"Mountain View, CA","Job opening at Google for Mountain View, CA.",Technical Product Manager
The Value Maximizer,Unknown,Scrum Master,Job opening at The Value Maximizer for Scrum Master.,Scrum Master
OP,Unknown,Scrum Master,Job opening at OP for Scrum Master.,Scrum Master
Origence,Unknown,Scrum Master,Job opening at Origence for Scrum Master.,Scrum Master
MissionStaff,Unknown,Scrum Master,"Philadelphia, PA",Scrum Master
Coforge,Unknown,Scrum Master,"Oaks, PA",Scrum Master
NVIDIA,Unknown,Senior CI/CD Engineer,Job opening at NVIDIA for Senior CI/CD Engineer.,CI/CD Engineer
Guidehouse,Unknown,CI/CD Engineer,Job opening at Guidehouse for CI/CD Engineer.,CI/CD Engineer
Agility Consulting International,Unknown,DevOps CI/CD Engineer,Job opening at Agility Consulting International for DevOps CI/CD Engineer.,CI/CD Engineer
Tata Consultancy Services,Unknown,Automation CI/CD Engineer,Job opening at Tata Consultancy Services for Automation CI/CD Engineer.,CI/CD Engineer
The Value Maximizer,Unknown,ML Specialist,Job opening at The Value Maximizer for ML Specialist.,CI/CD Engineer
Pure Talent Consulting,Unknown,Infrastructure Engineer,"Cleveland, OH",Infrastructure as Code Engineer
Earnest,Unknown,Cloud Engineer II,Job opening at Earnest for Cloud Engineer II.,Infrastructure as Code Engineer
Kforce Inc,Unknown,AI Engineer,"Chantilly, VA",Infrastructure as Code Engineer
"Newtown Square, PA",Unknown,"Sr. Engineer, Cloud","Job opening at Newtown Square, PA for Sr. Engineer, Cloud.",Infrastructure as Code Engineer
"Newtown Square, PA",Unknown,Intuitive.ai,"Job opening at Newtown Square, PA for Intuitive.ai.",Infrastructure as Code Engineer
Apple,Unknown,DevOps Engineer,Job opening at Apple for DevOps Engineer.,Release Engineer
Paramount,Unknown,DevOps Engineer,Job opening at Paramount for DevOps Engineer.,Release Engineer
Apple,Unknown,DevOps Engineer - Info Apps,Job opening at Apple for DevOps Engineer - Info Apps.,Release Engineer
Unknown Company,Unknown,DevOps Engineer,,Release Engineer
Unknown Company,Unknown,Rain,,Release Engineer
XPENG,Unknown,"Machine Learning Engineer - LLM, AI & Robotics","Job opening at XPENG for Machine Learning Engineer - LLM, AI & Robotics.",Automation Engineer
Atlas OT,Unknown,Sr. Controls and Automation Engineer,"Grand Junction, CO",Automation Engineer
Cisco,Unknown,Mechanical Engineer (Process Automation Engineer),Job opening at Cisco for Mechanical Engineer (Process Automation Engineer).,Automation Engineer
Salcomp Manufacturing USA,Unknown,Automation Engineer,Job opening at Salcomp Manufacturing USA for Automation Engineer.,Automation Engineer
Manpower San Diego,Unknown,Senior Automation Engineer,Job opening at Manpower San Diego for Senior Automation Engineer.,Automation Engineer
Analytica,Unknown,Senior OpenShift Engineer,"Washington, DC",Containerization Engineer
MetroStar,Unknown,DevSecOps Engineer (6406),"Washington, DC 3 hours ago",Containerization Engineer
Net2Source (N2S),Unknown,Kubernetes Engineer,"Columbus, Ohio Metropolitan Area 2 hours ago",Containerization Engineer
OpalSoft,Unknown,DevSecOps Engineer,"Bethesda, MD Medical insurance +4 benefits",Containerization Engineer
"Torch Technologies, Inc.",Unknown,Containerization Engineer,"Redstone Arsenal, AL",Containerization Engineer
For Employers,Unknown,AI Agent,About Us Blog No More Solo Job Hunting,Front-End Engineer
For Employers,Unknown,Resume AI,About Us Blog No More Solo Job Hunting,Front-End Engineer
TRY FOR FREE,Unknown,Do it with AI,"REAL RESULTS, NOT JUST PROMISES 1,250,000 trusted users",Front-End Engineer
TRY FOR FREE,Unknown,"Get matched jobs, autofill applications, tailored resume, and recommended insider connections in less than 1 min!","REAL RESULTS, NOT JUST PROMISES 1,250,000 trusted users",Front-End Engineer
Selective Insurance · just now,Unknown,Senior Partner Marketing Manager,Job opening at Selective Insurance · just now for Senior Partner Marketing Manager.,Front-End Engineer
For Employers,Unknown,AI Agent,About Us Blog No More Solo Job Hunting,Back-End Engineer
For Employers,Unknown,Resume AI,About Us Blog No More Solo Job Hunting,Back-End Engineer
TRY FOR FREE,Unknown,Do it with AI,"REAL RESULTS, NOT JUST PROMISES 1,250,000 trusted users",Back-End Engineer
TRY FOR FREE,Unknown,"Get matched jobs, autofill applications, tailored resume, and recommended insider connections in less than 1 min!","REAL RESULTS, NOT JUST PROMISES 1,250,000 trusted users",Back-End Engineer
Selective Insurance · just now,Unknown,Senior Partner Marketing Manager,Job opening at Selective Insurance · just now for Senior Partner Marketing Manager.,Back-End Engineer
For Employers,Unknown,AI Agent,About Us Blog No More Solo Job Hunting,Full-Stack Engineer
For Employers,Unknown,Resume AI,About Us Blog No More Solo Job Hunting,Full-Stack Engineer
TRY FOR FREE,Unknown,Do it with AI,"REAL RESULTS, NOT JUST PROMISES 1,250,000 trusted users",Full-Stack Engineer
TRY FOR FREE,Unknown,"Get matched jobs, autofill applications, tailored resume, and recommended insider connections in less than 1 min!","REAL RESULTS, NOT JUST PROMISES 1,250,000 trusted users",Full-Stack Engineer
Capital One · just now,Unknown,Sr. Information Delivery Analyst (Hybrid),Job opening at Capital One · just now for Sr. Information Delivery Analyst (Hybrid).,Full-Stack Engineer
For Employers,Unknown,AI Agent,About Us Blog No More Solo Job Hunting,Mobile Engineer
For Employers,Unknown,Resume AI,About Us Blog No More Solo Job Hunting,Mobile Engineer
TRY FOR FREE,Unknown,Do it with AI,"REAL RESULTS, NOT JUST PROMISES 1,250,000 trusted users",Mobile Engineer
TRY FOR FREE,Unknown,"Get matched jobs, autofill applications, tailored resume, and recommended insider connections in less than 1 min!","REAL RESULTS, NOT JUST PROMISES 1,250,000 trusted users",Mobile Engineer
80%,Unknown,interviews landed,time saved on job search No.1 Choice for 80% of job seekers after their first use,Mobile Engineer
For Employers,Unknown,AI Agent,About Us Blog No More Solo Job Hunting,Systems Engineer
For Employers,Unknown,Resume AI,About Us Blog No More Solo Job Hunting,Systems Engineer
TRY FOR FREE,Unknown,Do it with AI,"REAL RESULTS, NOT JUST PROMISES 1,250,000 trusted users",Systems Engineer
TRY FOR FREE,Unknown,"Get matched jobs, autofill applications, tailored resume, and recommended insider connections in less than 1 min!","REAL RESULTS, NOT JUST PROMISES 1,250,000 trusted users",Systems Engineer
Senior Partner Marketing Manager,Unknown,Sitecore · 1 minute ago,Selective Insurance · 1 minute ago,Systems Engineer
About Us,Unknown,AI Agent,Blog No More Solo Job Hunting,Game Developer
About Us,Unknown,Resume AI,Blog No More Solo Job Hunting,Game Developer
About Us,Unknown,For Employers,Blog No More Solo Job Hunting,Game Developer
TRY FOR FREE,Unknown,Do it with AI,"REAL RESULTS, NOT JUST PROMISES 1,250,000 trusted users",Game Developer
TRY FOR FREE,Unknown,"Get matched jobs, autofill applications, tailored resume, and recommended insider connections in less than 1 min!","REAL RESULTS, NOT JUST PROMISES 1,250,000 trusted users",Game Developer
For Employers,Unknown,AI Agent,About Us Blog No More Solo Job Hunting,Security Analyst
For Employers,Unknown,Resume AI,About Us Blog No More Solo Job Hunting,Security Analyst
TRY FOR FREE,Unknown,Do it with AI,"REAL RESULTS, NOT JUST PROMISES 1,250,000",Security Analyst
TRY FOR FREE,Unknown,"Get matched jobs, autofill applications, tailored resume, and recommended insider connections in less than 1 min!","REAL RESULTS, NOT JUST PROMISES 1,250,000",Security Analyst
3x,Unknown,trusted users,interviews landed 80% time saved on job search,Security Analyst
For Employers,Unknown,AI Agent,About Us Blog No More Solo Job Hunting,Penetration Tester
For Employers,Unknown,Resume AI,About Us Blog No More Solo Job Hunting,Penetration Tester
TRY FOR FREE,Unknown,Do it with AI,"REAL RESULTS, NOT JUST PROMISES 1,250,000",Penetration Tester
TRY FOR FREE,Unknown,"Get matched jobs, autofill applications, tailored resume, and recommended insider connections in less than 1 min!","REAL RESULTS, NOT JUST PROMISES 1,250,000",Penetration Tester
3x,Unknown,trusted users,Job opening at 3x for trusted users.,Penetration Tester
For Employers,Unknown,AI Agent,About Us Blog No More Solo Job Hunting,Security Engineer
For Employers,Unknown,Resume AI,About Us Blog No More Solo Job Hunting,Security Engineer
TRY FOR FREE,Unknown,Do it with AI,"REAL RESULTS, NOT JUST PROMISES 1,250,000 trusted users",Security Engineer
TRY FOR FREE,Unknown,"Get matched jobs, autofill applications, tailored resume, and recommended insider connections in less than 1 min!","REAL RESULTS, NOT JUST PROMISES 1,250,000 trusted users",Security Engineer
